{
  "tc_id": "TC-033",
  "tc_name": "Dose Intensity Summary",
  "metadata": {
    "n_total": 200,
    "n_experimental": 100,
    "n_control": 100,
    "population": "SAFETY",
    "rdi_threshold": 80,
    "duration_unit": "weeks",
    "dose_unit": "mg",
    "r_version": "R version 4.6.1 (2026-06-24)"
  },
  "rdi_summary": {
    "experimental": {
      "n": 100,
      "mean": 84.0138,
      "sd": 8.5985,
      "median": 84.94,
      "min": 70.27,
      "max": 99.84,
      "q1": 77.0225,
      "q3": 91.2325
    },
    "control": {
      "n": 100,
      "mean": 89.5835,
      "sd": 5.6842,
      "median": 89.075,
      "min": 80.24,
      "max": 99.86,
      "q1": 85.055,
      "q3": 94.3025
    }
  },
  "rdi_ge80": {
    "experimental": {
      "n": 66,
      "pct": 66
    },
    "control": {
      "n": 100,
      "pct": 100
    }
  },
  "dose_reduction": {
    "experimental": {
      "n": 14,
      "pct": 14
    },
    "control": {
      "n": 10,
      "pct": 10
    }
  },
  "dose_interruption": {
    "experimental": {
      "n": 8,
      "pct": 8
    },
    "control": {
      "n": 6,
      "pct": 6
    }
  },
  "treatment_duration": {
    "experimental": {
      "n": 100,
      "mean": 46.84,
      "sd": 8.8394,
      "median": 47,
      "min": 28,
      "max": 69,
      "q1": 40,
      "q3": 52.25
    },
    "control": {
      "n": 100,
      "mean": 27.36,
      "sd": 6.5033,
      "median": 27,
      "min": 12,
      "max": 48,
      "q1": 23,
      "q3": 31
    }
  },
  "per_subject": [
    {
      "USUBJID": "SUB0001",
      "TRT01A": "Experimental",
      "TREATDUR": 43,
      "PLANDOSE": 3612,
      "ACTUALDOSE": 3370.68,
      "RDI": 93.32,
      "DOSERED": 0,
      "DOSEINT": 0
    },
    {
      "USUBJID": "SUB0002",
      "TRT01A": "Experimental",
      "TREATDUR": 44,
      "PLANDOSE": 3696,
      "ACTUALDOSE": 3170.59,
      "RDI": 85.78,
      "DOSERED": 0,
      "DOSEINT": 0
    },
    {
      "USUBJID": "SUB0003",
      "TRT01A": "Control",
      "TREATDUR": 28,
      "PLANDOSE": 1176,
      "ACTUALDOSE": 1128.27,
      "RDI": 95.94,
      "DOSERED": 0,
      "DOSEINT": 0
    },
    {
      "USUBJID": "SUB0004",
      "TRT01A": "Experimental",
      "TREATDUR": 37,
      "PLANDOSE": 3108,
      "ACTUALDOSE": 2646.4,
      "RDI": 85.15,
      "DOSERED": 0,
      "DOSEINT": 0
    },
    {
      "USUBJID": "SUB0005",
      "TRT01A": "Control",
      "TREATDUR": 32,
      "PLANDOSE": 1344,
      "ACTUALDOSE": 1236.25,
      "RDI": 91.98,
      "DOSERED": 0,
      "DOSEINT": 0
    },
    {
      "USUBJID": "SUB0006",
      "TRT01A": "Control",
      "TREATDUR": 21,
      "PLANDOSE": 882,
      "ACTUALDOSE": 768.97,
      "RDI": 87.18,
      "DOSERED": 0,
      "DOSEINT": 0
    },
    {
      "USUBJID": "SUB0007",
      "TRT01A": "Control",
      "TREATDUR": 32,
      "PLANDOSE": 1344,
      "ACTUALDOSE": 1257.46,
      "RDI": 93.56,
      "DOSERED": 0,
      "DOSEINT": 0
    },
    {
      "USUBJID": "SUB0008",
      "TRT01A": "Control",
      "TREATDUR": 21,
      "PLANDOSE": 882,
      "ACTUALDOSE": 770.15,
      "RDI": 87.32,
      "DOSERED": 0,
      "DOSEINT": 0
    },
    {
      "USUBJID": "SUB0009",
      "TRT01A": "Experimental",
      "TREATDUR": 43,
      "PLANDOSE": 3612,
      "ACTUALDOSE": 2592.58,
      "RDI": 71.78,
      "DOSERED": 0,
      "DOSEINT": 0
    },
    {
      "USUBJID": "SUB0010",
      "TRT01A": "Experimental",
      "TREATDUR": 36,
      "PLANDOSE": 3024,
      "ACTUALDOSE": 2727.1,
      "RDI": 90.18,
      "DOSERED": 1,
      "DOSEINT": 0
    },
    {
      "USUBJID": "SUB0011",
      "TRT01A": "Experimental",
      "TREATDUR": 48,
      "PLANDOSE": 4032,
      "ACTUALDOSE": 3581.21,
      "RDI": 88.82,
      "DOSERED": 0,
      "DOSEINT": 0
    },
    {
      "USUBJID": "SUB0012",
      "TRT01A": "Experimental",
      "TREATDUR": 40,
      "PLANDOSE": 3360,
      "ACTUALDOSE": 2425.44,
      "RDI": 72.19,
      "DOSERED": 1,
      "DOSEINT": 0
    },
    {
      "USUBJID": "SUB0013",
      "TRT01A": "Experimental",
      "TREATDUR": 43,
      "PLANDOSE": 3612,
      "ACTUALDOSE": 3002.7,
      "RDI": 83.13,
      "DOSERED": 0,
      "DOSEINT": 0
    },
    {
      "USUBJID": "SUB0014",
      "TRT01A": "Control",
      "TREATDUR": 16,
      "PLANDOSE": 672,
      "ACTUALDOSE": 657.8,
      "RDI": 97.89,
      "DOSERED": 0,
      "DOSEINT": 0
    },
    {
      "USUBJID": "SUB0015",
      "TRT01A": "Control",
      "TREATDUR": 21,
      "PLANDOSE": 882,
      "ACTUALDOSE": 831.47,
      "RDI": 94.27,
      "DOSERED": 0,
      "DOSEINT": 0
    },
    {
      "USUBJID": "SUB0016",
      "TRT01A": "Experimental",
      "TREATDUR": 37,
      "PLANDOSE": 3108,
      "ACTUALDOSE": 2540.87,
      "RDI": 81.75,
      "DOSERED": 0,
      "DOSEINT": 0
    },
    {
      "USUBJID": "SUB0017",
      "TRT01A": "Control",
      "TREATDUR": 24,
      "PLANDOSE": 1008,
      "ACTUALDOSE": 988.6,
      "RDI": 98.08,
      "DOSERED": 0,
      "DOSEINT": 0
    },
    {
      "USUBJID": "SUB0018",
      "TRT01A": "Control",
      "TREATDUR": 25,
      "PLANDOSE": 1050,
      "ACTUALDOSE": 940.23,
      "RDI": 89.55,
      "DOSERED": 0,
      "DOSEINT": 0
    },
    {
      "USUBJID": "SUB0019",
      "TRT01A": "Control",
      "TREATDUR": 26,
      "PLANDOSE": 1092,
      "ACTUALDOSE": 888.18,
      "RDI": 81.34,
      "DOSERED": 0,
      "DOSEINT": 0
    },
    {
      "USUBJID": "SUB0020",
      "TRT01A": "Control",
      "TREATDUR": 25,
      "PLANDOSE": 1050,
      "ACTUALDOSE": 991.17,
      "RDI": 94.4,
      "DOSERED": 0,
      "DOSEINT": 0
    },
    {
      "USUBJID": "SUB0021",
      "TRT01A": "Experimental",
      "TREATDUR": 38,
      "PLANDOSE": 3192,
      "ACTUALDOSE": 3127.13,
      "RDI": 97.97,
      "DOSERED": 0,
      "DOSEINT": 0
    },
    {
      "USUBJID": "SUB0022",
      "TRT01A": "Control",
      "TREATDUR": 17,
      "PLANDOSE": 714,
      "ACTUALDOSE": 617.84,
      "RDI": 86.53,
      "DOSERED": 0,
      "DOSEINT": 0
    },
    {
      "USUBJID": "SUB0023",
      "TRT01A": "Experimental",
      "TREATDUR": 49,
      "PLANDOSE": 4116,
      "ACTUALDOSE": 2959.69,
      "RDI": 71.91,
      "DOSERED": 1,
      "DOSEINT": 0
    },
    {
      "USUBJID": "SUB0024",
      "TRT01A": "Control",
      "TREATDUR": 29,
      "PLANDOSE": 1218,
      "ACTUALDOSE": 1054.96,
      "RDI": 86.61,
      "DOSERED": 0,
      "DOSEINT": 0
    },
    {
      "USUBJID": "SUB0025",
      "TRT01A": "Control",
      "TREATDUR": 38,
      "PLANDOSE": 1596,
      "ACTUALDOSE": 1308.27,
      "RDI": 81.97,
      "DOSERED": 0,
      "DOSEINT": 0
    },
    {
      "USUBJID": "SUB0026",
      "TRT01A": "Experimental",
      "TREATDUR": 56,
      "PLANDOSE": 4704,
      "ACTUALDOSE": 4411.99,
      "RDI": 93.79,
      "DOSERED": 0,
      "DOSEINT": 0
    },
    {
      "USUBJID": "SUB0027",
      "TRT01A": "Control",
      "TREATDUR": 36,
      "PLANDOSE": 1512,
      "ACTUALDOSE": 1438.27,
      "RDI": 95.12,
      "DOSERED": 0,
      "DOSEINT": 0
    },
    {
      "USUBJID": "SUB0028",
      "TRT01A": "Experimental",
      "TREATDUR": 65,
      "PLANDOSE": 5460,
      "ACTUALDOSE": 5308.68,
      "RDI": 97.23,
      "DOSERED": 1,
      "DOSEINT": 0
    },
    {
      "USUBJID": "SUB0029",
      "TRT01A": "Control",
      "TREATDUR": 37,
      "PLANDOSE": 1554,
      "ACTUALDOSE": 1328.52,
      "RDI": 85.49,
      "DOSERED": 0,
      "DOSEINT": 0
    },
    {
      "USUBJID": "SUB0030",
      "TRT01A": "Experimental",
      "TREATDUR": 46,
      "PLANDOSE": 3864,
      "ACTUALDOSE": 3751.22,
      "RDI": 97.08,
      "DOSERED": 0,
      "DOSEINT": 0
    },
    {
      "USUBJID": "SUB0031",
      "TRT01A": "Experimental",
      "TREATDUR": 34,
      "PLANDOSE": 2856,
      "ACTUALDOSE": 2458.2,
      "RDI": 86.07,
      "DOSERED": 0,
      "DOSEINT": 0
    },
    {
      "USUBJID": "SUB0032",
      "TRT01A": "Experimental",
      "TREATDUR": 54,
      "PLANDOSE": 4536,
      "ACTUALDOSE": 3649.49,
      "RDI": 80.46,
      "DOSERED": 0,
      "DOSEINT": 0
    },
    {
      "USUBJID": "SUB0033",
      "TRT01A": "Control",
      "TREATDUR": 28,
      "PLANDOSE": 1176,
      "ACTUALDOSE": 1063.42,
      "RDI": 90.43,
      "DOSERED": 0,
      "DOSEINT": 0
    },
    {
      "USUBJID": "SUB0034",
      "TRT01A": "Control",
      "TREATDUR": 39,
      "PLANDOSE": 1638,
      "ACTUALDOSE": 1561.3,
      "RDI": 95.32,
      "DOSERED": 0,
      "DOSEINT": 0
    },
    {
      "USUBJID": "SUB0035",
      "TRT01A": "Experimental",
      "TREATDUR": 50,
      "PLANDOSE": 4200,
      "ACTUALDOSE": 3609.58,
      "RDI": 85.94,
      "DOSERED": 0,
      "DOSEINT": 0
    },
    {
      "USUBJID": "SUB0036",
      "TRT01A": "Control",
      "TREATDUR": 19,
      "PLANDOSE": 798,
      "ACTUALDOSE": 772.18,
      "RDI": 96.76,
      "DOSERED": 0,
      "DOSEINT": 0
    },
    {
      "USUBJID": "SUB0037",
      "TRT01A": "Control",
      "TREATDUR": 30,
      "PLANDOSE": 1260,
      "ACTUALDOSE": 1245.07,
      "RDI": 98.81,
      "DOSERED": 0,
      "DOSEINT": 0
    },
    {
      "USUBJID": "SUB0038",
      "TRT01A": "Control",
      "TREATDUR": 37,
      "PLANDOSE": 1554,
      "ACTUALDOSE": 1374.6,
      "RDI": 88.46,
      "DOSERED": 0,
      "DOSEINT": 0
    },
    {
      "USUBJID": "SUB0039",
      "TRT01A": "Control",
      "TREATDUR": 26,
      "PLANDOSE": 1092,
      "ACTUALDOSE": 1005.67,
      "RDI": 92.09,
      "DOSERED": 0,
      "DOSEINT": 0
    },
    {
      "USUBJID": "SUB0040",
      "TRT01A": "Experimental",
      "TREATDUR": 35,
      "PLANDOSE": 2940,
      "ACTUALDOSE": 2710.58,
      "RDI": 92.2,
      "DOSERED": 1,
      "DOSEINT": 0
    },
    {
      "USUBJID": "SUB0041",
      "TRT01A": "Experimental",
      "TREATDUR": 55,
      "PLANDOSE": 4620,
      "ACTUALDOSE": 4212.15,
      "RDI": 91.17,
      "DOSERED": 0,
      "DOSEINT": 1
    },
    {
      "USUBJID": "SUB0042",
      "TRT01A": "Control",
      "TREATDUR": 31,
      "PLANDOSE": 1302,